City,EduID,AC_YEAR,Name,Locality,Street Address,VILLAGE_NAME,State,Pincode,,,,h_place_id,h_category,h_col,h_word,h_name,h_address
MAMIT,15010102001,2015-16,GOVT. ZAWLNUAM P/S-III,MAMIT,ZAWLNUAM,ZAWLNUAM THUAMPUI,Mizoram,796471,,,,,,,,,
MAMIT,15010102003,2015-16,GOVT. ZAWLNUAM M/S-I,MAMIT,ZAWLNUAM,ZAWLNUAM THUAMPUI,Mizoram,796471,,,,ChIJqaqqqnv4UTcRPyn_7-IsZM4,A,Street Address,zawlnuam,Govt. Zawlnuam College,"Zawlnuam, Thuampui, Zawlnuam, Mizoram 796471, India"
MAMIT,15010102006,2015-16,"BAPTIST ENGLISH P/S, ZAWLNUAM THUAMPUI (Pvt.)",MAMIT,ZAWLNUAM,ZAWLNUAM THUAMPUI,Mizoram,796471,,,,,,,,,
MAMIT,15010102007,2015-16,"BAPTIST ENGLISH M/S, ZAWLNUAM THUAMPUI (GIA)",MAMIT,ZAWLNUAM,ZAWLNUAM THUAMPUI,Mizoram,796471,,,,,,,,,
KOLASIB,15020100112,2015-16,"CHAWNGHMINGLIANI MEMORIAL HIGH SCHOOL, KOLASIB (ADHOC)",KOLASIB,KOLASIB,KOLASIB - I,Mizoram,796081,,,,,,,,,
KOLASIB,15020100113,2015-16,"HMARVENG RMSA SECONDARY SCHOOL, KOLASIB",KOLASIB,KOLASIB,KOLASIB - I,Mizoram,796081,,,,,,,,,
KOLASIB,15020100114,2015-16,TUICHHUAHEN P/S (SSA),KOLASIB,KOLASIB,KOLASIB - I,Mizoram,796081,,,,,,,,,
KOLASIB,15020100115,2015-16,TUICHHUAHEN UPS (SSA),KOLASIB,KOLASIB,KOLASIB - I,Mizoram,796081,,,,,,,,,
KOLASIB,15020100116,2015-16,ST. ALOYSIUS SCHOOL,KOLASIB,KOLASIB,KOLASIB - I,Mizoram,796081,,,,ChIJA_uEXMYOTjcRhlfhNk1gI0A,A,Street Address,kolasib,St. John's Higher Secondary School,"Venglai, Kolasib, Mizoram 796081, India"
MAMIT,15010100712,2015-16,NEW MAMIT RMSA SECONDARY SCHOOL,MAMIT,NEW MAMIT,NEW MAMIT,Mizoram,796441,,,,ChIJv4WnKFX2TTcRKzJ-qXXk2J0,B,Locality,mamit,RMSA Secondary School New Mamit,"Aizawl-Mamit-Vanhmun-Kumarghat Rd, LUANGPAWL, Mamit, Mizoram 796441, India"
MAMIT,15010201807,2015-16,"CHHIMVENG PRESBYTERIAN SCHOOL, P/S, W.PHAILENG (Pvt.)",W.PHAILENG,W.PHAILENG,W.PHAILENG,Mizoram,796431,,,,,,,,,
MAMIT,15010201808,2015-16,W. PHAILENG HIGHER SECONDARY SCHOOL,W.PHAILENG,W.PHAILENG,W.PHAILENG,Mizoram,796431,,,,ChIJmWEKRPiKTTcRRdGSrsGsxtM,A,Street Address,w.phaileng,Western High School,"W Phaileng - Marpara Rd, W.Phaileng, Mizoram 796431, India"
MAMIT,15010201809,2015-16,"GOSPEL CENTENARY HIGH SCHOOL, W. PHAILENG (ADHOC AIDED)",W.PHAILENG,W.PHAILENG,W.PHAILENG,Mizoram,796431,,,,,,,,,
KOLASIB,15020301405,2015-16,SAIPUM HIGH SCHOOL (ADHOC),BILKHAWTHLIR,BILKHAWTHLIR,SAIPUM,Mizoram,796101,,,,ChIJA0tV7ixsTjcRr_Hq4_5hz5o,A,VILLAGE_NAME,saipum,Saipum High School,"Saipum, Mizoram, India"
KOLASIB,15020301406,2015-16,PARTNERSHIP MISSION SCHOOL SAIPUM,BILKHAWTHLIR,VAIRENGTE,SAIPUM,Mizoram,796091,,,,ChIJqWbDzLUOTjcRgZ1ka_1cl7A,C,City,kolasib,HOME MISSIONS SCHOOL (KOLASIB),"New Diakkawn, Kolasib, Mizoram 796081, India"
AIZAWL,15030100906,2015-16,ST. LAWRENCE SCHOOL,ELECTRIC,ELECTRIC,RAMTHAR,Mizoram,796007,,,,ChIJYaFBwDLrTTcRnq9RJech1yQ,A,VILLAGE_NAME,ramthar,St. Lawrence School,"Ramthar Veng, Aizawl, Mizoram 796007, India"
AIZAWL,15030100907,2015-16,GOVT. REPUBLIC HIGH SCHOOL,ELECTRIC,ELECTRIC,RAMTHAR,Mizoram,796007,,,,ChIJF5GgTcuUTTcRdfuYGAQkfLk,A,VILLAGE_NAME,ramthar,Government Republic Higher Secondary School,"Ramthar Rd, Aizawl, Mizoram 796007, India"
AIZAWL,15030100908,2015-16,GOVT. REPUBLIC HIGHER SECONDARY  SCHOOL,ELECTRIC,ELECTRIC,RAMTHAR,Mizoram,796007,,,,ChIJVVVVqcyUTTcRDSLaCGUtZYM,A,VILLAGE_NAME,ramthar,Govt.Republic Higher Secondary School,"Ramthar Veng, Aizawl, Mizoram 796007, India"
MAMIT,15010102101,2015-16,GOVT. ZAWLNUAM P/S-I,MAMIT,ZAWLNUAM,ZAWLNUAM VENGPUI,Mizoram,796471,,,,ChIJqaqqqnv4UTcRPyn_7-IsZM4,A,Street Address,zawlnuam,Govt. Zawlnuam College,"Zawlnuam, Thuampui, Zawlnuam, Mizoram 796471, India"
MAMIT,15010102102,2015-16,GOVT. ZAWLNUAM P/S-II,MAMIT,ZAWLNUAM,ZAWLNUAM VENGPUI,Mizoram,796471,,,,,,,,,
MAMIT,15010102103,2015-16,GOVT. ZAWLNUAM M/S-II,MAMIT,ZAWLNUAM,ZAWLNUAM VENGPUI,Mizoram,796471,,,,ChIJsboWq4j3TTcR_BbQYzz8mns,B,Locality,mamit,"Govt M/S II, Mamit","Venghlun, Mamit, Mizoram 796441, India"
MAMIT,15010102104,2015-16,ZAWLNUAM PUBLIC M/S (GIA),MAMIT,ZAWLNUAM,ZAWLNUAM VENGPUI,Mizoram,796471,,,,,,,,,
MAMIT,15010102105,2015-16,ZAWLNUAM PUBLIC P/S (Pvt.),MAMIT,ZAWLNUAM,ZAWLNUAM VENGPUI,Mizoram,796471,,,,,,,,,
KOLASIB,15020100201,2015-16,GOVT.VENGLAI M/S KOLASIB,KOLASIB,KOLASIB,KOLASIB - II,Mizoram,796081,,,,ChIJuRX-KMEOTjcR-QG8cws3X6c,A,Street Address,kolasib,Govt. Kolasib M.S,"Hmar Veng, Kolasib, Mizoram 796081, India"
KOLASIB,15020100202,2015-16,GOVT. P/S - III KOLASIB,KOLASIB,KOLASIB,KOLASIB - II,Mizoram,796081,,,,ChIJBahCNsEOTjcRjyc0yaQg1wg,A,Street Address,kolasib,Kolasib Police Station,"Hmar Veng, Kolasib, Mizoram 796081, India"
KOLASIB,15020100203,2015-16,GOVT. P/S - XIV KOLASIB,KOLASIB,KOLASIB,KOLASIB - II,Mizoram,796081,,,,ChIJBahCNsEOTjcRjyc0yaQg1wg,A,Street Address,kolasib,Kolasib Police Station,"Hmar Veng, Kolasib, Mizoram 796081, India"
KOLASIB,15020100204,2015-16,"ST,MARIA P/S (PVT) KOLASIB",KOLASIB,KOLASIB,KOLASIB - II,Mizoram,796081,,,,ChIJA_uEXMYOTjcRhlfhNk1gI0A,A,Street Address,kolasib,St. John's Higher Secondary School,"Venglai, Kolasib, Mizoram 796081, India"
MAMIT,15010201810,2015-16,GOVT. W.PHAILENG HIGH SCHOOL,W.PHAILENG,W.PHAILENG,W.PHAILENG,Mizoram,796431,,,,ChIJmWEKRPiKTTcRRdGSrsGsxtM,A,Street Address,w.phaileng,Western High School,"W Phaileng - Marpara Rd, W.Phaileng, Mizoram 796431, India"
MAMIT,15010201811,2015-16,ADVENTIST ENGLISH SCHOOL (Pvt.),W.PHAILENG,W.PHAILENG,W.PHAILENG,Mizoram,796431,,,,ChIJQ0h9u-2KTTcRjT8GHPUtZwg,A,Street Address,w.phaileng,Adventist English School,"Dinthar Kawn, New W.Phaileng, Mizoram 796431, India"
MAMIT,15010201812,2015-16,"CHHIMVENG PRESBYTERIAN SCHOOL, M/S, W.PHAILENG (Pvt.)",W.PHAILENG,W.PHAILENG,W.PHAILENG,Mizoram,796431,,,,,,,,,
KOLASIB,15020200602,2015-16,GOVT. M/S SERKHAN,KAWNPUI,LUNGDAI,SERKHAN,Mizoram,796070,,,,ChIJmYTbNvXmTTcRxtM-G_NUYS0,B,Locality,kawnpui,Govt MS Zanlawn,"Kawnpui - Durtlang - Silchar Rd, Zanlawn, Mizoram 796070, India"
AIZAWL,15030100909,2015-16,"PRESBYTERIAN ENGLISH SCHOOL, RAMTHAR",ELECTRIC,ELECTRIC,RAMTHAR,Mizoram,796007,,,,ChIJ57YwErbsTTcRTtXLXUGSQzg,C,City,aizawl,Presbyterian English School,"Tuivamit, Aizawl, Mizoram 796009, India"
AIZAWL,15030101001,2015-16,GOVT. AIZAWL VENGLAI M/S,ELECTRIC,ELECTRIC,AIZAWL VENGLAI,Mizoram,796007,,,,ChIJswWitDTrTTcR_0WsFRZkFw0,B,Pincode,796007,Government Zirtiri Residential Science College,"Ramthar Veng, Aizawl, Mizoram 796007, India"
AIZAWL,15030101002,2015-16,GOVT. AIZAWL VENGLAI P/S,ELECTRIC,ELECTRIC,AIZAWL VENGLAI,Mizoram,796007,,,,ChIJswWitDTrTTcR_0WsFRZkFw0,B,Pincode,796007,Government Zirtiri Residential Science College,"Ramthar Veng, Aizawl, Mizoram 796007, India"
AIZAWL,15030101005,2015-16,VINCENT SCHOOL,ELECTRIC,ELECTRIC,AIZAWL VENGLAI,Mizoram,796007,,,,ChIJBVWpdsCUTTcRvCoieBLFef8,C,City,aizawl,Government Aizawl College,"Aizawl, Mizoram 796001, India"
KOLASIB,15020100101,2015-16,GOVT. KHIANGA M/S KOLASIB,KOLASIB,KOLASIB,KOLASIB - I,Mizoram,796081,,,,ChIJidChFL8OTjcR3OsrrDDxDwY,A,Street Address,kolasib,Minor Irrigation Dept,"Electric Veng, Kolasib, Mizoram 796081, India"
KOLASIB,15020100102,2015-16,GOVT. M/S KOLASIB,KOLASIB,KOLASIB,KOLASIB - I,Mizoram,796081,,,,ChIJuRX-KMEOTjcR-QG8cws3X6c,A,Street Address,kolasib,Govt. Kolasib M.S,"Hmar Veng, Kolasib, Mizoram 796081, India"
KOLASIB,15020100103,2015-16,GOVT. D.S.GORKHA M/S,KOLASIB,KOLASIB,KOLASIB - I,Mizoram,796081,,,,ChIJnWrVNMcOTjcRiBpsdvkIhgA,A,Street Address,kolasib,Gorkha M/S,"Kolasib, Mizoram 796081, India"
KOLASIB,15020100105,2015-16,GOVT. P/S - I,KOLASIB,KOLASIB,KOLASIB - I,Mizoram,796081,,,,ChIJBahCNsEOTjcRjyc0yaQg1wg,A,Street Address,kolasib,Kolasib Police Station,"Hmar Veng, Kolasib, Mizoram 796081, India"
KOLASIB,15020100205,2015-16,ST.MARIA M/S KOLASIB (DEFICIT),KOLASIB,KOLASIB,KOLASIB - II,Mizoram,796081,,,,ChIJn3LBH8YOTjcRRyqedWZADR8,A,Street Address,kolasib,St. Maria Goretti School,"Venglai, Kolasib, Mizoram 796081, India"
KOLASIB,15020301512,2015-16,PMS ENGLISH P/S SAIPHAI,BILKHAWTHLIR,VAIRENGTE,SAIPHAI,Mizoram,796091,,,,,,,,,
AIZAWL,15030100101,2015-16,GOVT. LAIPUITLANG ENGLISH MEDIUM M/S,ELECTRIC,CHALTLANG,LAIPUITLANG,Mizoram,796012,,,,,,,,,
AIZAWL,15030100102,2015-16,GOVT. LAIPUITLANG P/S,ELECTRIC,CHALTLANG,LAIPUITLANG,Mizoram,796012,,,,ChIJ1Q0r6zDrTTcR1mZUyZnqlwo,A,Street Address,chaltlang,Govt. Aizawl North College,"Chaltlang, Aizawl, Mizoram 796012, India"
KOLASIB,15020200603,2015-16,CEE TEE ACADEMY SERKHAN,KAWNPUI,LUNGDAI,SERKHAN,Mizoram,796070,,,,,,,,,
MAMIT,15010100713,2015-16,ST. FRANCIS OF ASSISI HIGH SCHOOL,MAMIT,NEW MAMIT,NEW MAMIT,Mizoram,796441,,,,ChIJXU9bSYT3TTcRc7NmT89-ihg,B,Locality,mamit,St Francis of Asissi Primary School,"BAZAR VENG, Mamit, Mizoram 796441, India"
MAMIT,15010100714,2015-16,NEW DIAMOND SCHOOL (Pvt.),MAMIT,NEW MAMIT,NEW MAMIT,Mizoram,796441,,,,,,,,,
MAMIT,15010100715,2015-16,ST FRANCIS OF ASSISSI M/S MAMIT,MAMIT,NEW MAMIT,NEW MAMIT,Mizoram,796441,,,,ChIJXU9bSYT3TTcRc7NmT89-ihg,B,Locality,mamit,St Francis of Asissi Primary School,"BAZAR VENG, Mamit, Mizoram 796441, India"
MAMIT,15010300303,2015-16,NGHALCHAWM RMSA SECONDARY SCHOOL,RAWPUICHHIP,LENGTE,NGHALCHAWM,Mizoram,796410,,,,,,,,,
AIZAWL,15030101101,2015-16,GOVT. ELECTRIC M/S,ELECTRIC,ELECTRIC,ELECTRIC,Mizoram,796007,,,,ChIJpVrWfsqUTTcRR6GJ4dr32Rc,A,Street Address,electric,Govt. Pianghleia High School,"B 26/1, Church St, Electric Veng, Aizawl, Mizoram 796007, India"
AIZAWL,15030101102,2015-16,GOVT. ELECTRIC P/S-I,ELECTRIC,ELECTRIC,ELECTRIC,Mizoram,796007,,,,ChIJpVrWfsqUTTcRR6GJ4dr32Rc,A,Street Address,electric,Govt. Pianghleia High School,"B 26/1, Church St, Electric Veng, Aizawl, Mizoram 796007, India"
AIZAWL,15030101103,2015-16,GOVT. ELECTRIC P/S-II,ELECTRIC,ELECTRIC,ELECTRIC,Mizoram,796007,,,,,,,,,
AIZAWL,15030101104,2015-16,ST. MARY'S SCHOOL,ELECTRIC,ELECTRIC,ELECTRIC,Mizoram,796007,,,,ChIJ____j8qUTTcRM80GX7ME49U,A,Street Address,electric,St.Mary's School,"Electric Veng, Aizawl, Mizoram 796007, India"
KOLASIB,15020100106,2015-16,GOVT. P/S - VII,KOLASIB,KOLASIB,KOLASIB - I,Mizoram,796081,,,,ChIJ5zG-fi0BTjcRioXYjPhJvsA,B,Pincode,796081,Govt. P/S - II,"Bairabi Entrance, Bairabi, Mizoram 796081, India"
KOLASIB,15020100109,2015-16,BRIGHTER FAITH ACD. KLB(P),KOLASIB,KOLASIB,KOLASIB - I,Mizoram,796081,,,,,,,,,
MAMIT,15010103313,2015-16,JOWAHAR NAVODAYA VIDYALAYA SCHOOL,MAMIT,MAMIT,MAMIT HMARVENG,Mizoram,796441,,,,ChIJsTYjiy_4TTcRSKcU2qd6mEE,A,Street Address,mamit,JNV Mamit,"Dinthar Veng, Mamit, Mizoram, India"
MAMIT,15010103801,2015-16,HMUNTHATLANG P/S (SSA),MAMIT,KAWRTHAH,HMUNTHATLANG,Mizoram,796441,,,,,,,,,
AIZAWL,15030100201,2015-16,GOVT. CHALTLANG M/S,ELECTRIC,CHALTLANG,CHALTLANG,Mizoram,796012,,,,ChIJeZxnWzrrTTcRXJhKhbR1d-4,A,Street Address,chaltlang,"Govt. Chaltlang Higher Secondary School, Thlanmual Veng","Chaltlang, Aizawl, Mizoram 796012, India"
AIZAWL,15030100203,2015-16,GOVT. DIET PRACTICING M/S,ELECTRIC,CHALTLANG,CHALTLANG,Mizoram,796012,,,,,,,,,
AIZAWL,15030100204,2015-16,GOVT. CHALTLANG P/S-I,ELECTRIC,CHALTLANG,CHALTLANG,Mizoram,796012,,,,ChIJ1Q0r6zDrTTcR1mZUyZnqlwo,A,Street Address,chaltlang,Govt. Aizawl North College,"Chaltlang, Aizawl, Mizoram 796012, India"
AIZAWL,15030100206,2015-16,GOVT. DIET PRACTICING P/S,ELECTRIC,CHALTLANG,CHALTLANG,Mizoram,796012,,,,,,,,,
AIZAWL,15030200605,2015-16,PRES. SCHOOL REPUBLIC,VENGHLUI,VENGHLUI,REPUBLIC,Mizoram,796001,,,,ChIJv1Dj6b2UTTcRCzJHt_cFMg8,B,Pincode,796001,Khatla S Anganwadi Centre I,"Khatla South, Aizawl, Mizoram 796001, India"
MAMIT,15010300304,2015-16,R.K. MEMORIAL ENGLISH MEDIUM SCHOOL,RAWPUICHHIP,LENGTE,NGHALCHAWM,Mizoram,796410,,,,,,,,,
MAMIT,15010300401,2015-16,GOVT. SAITLAW P/S,RAWPUICHHIP,LENGTE,SAITLAW,Mizoram,796410,,,,,,,,,
MAMIT,15010300402,2015-16,SAITLAW UPS (SSA),RAWPUICHHIP,LENGTE,SAITLAW,Mizoram,796410,,,,,,,,,
MAMIT,15010300501,2015-16,GOVT. W. SERZAWL P/S,RAWPUICHHIP,LENGTE,W. SERZAWL,Mizoram,796410,,,,,,,,,
AIZAWL,15030200216,2015-16,ASSAM RIFLES P/S,VENGHLUI,DAWRPUI,DAWRPUI,Mizoram,796001,,,,ChIJ9TcK1aSUTTcRk7HkFiyQHjE,C,City,aizawl,Assam Rifles Mandir,"Khatla, Aizawl, Mizoram, India"
AIZAWL,15030200217,2015-16,ASSAM RIFLES M/S (DEFICIT),VENGHLUI,DAWRPUI,DAWRPUI,Mizoram,796001,,,,ChIJ9TcK1aSUTTcRk7HkFiyQHjE,C,City,aizawl,Assam Rifles Mandir,"Khatla, Aizawl, Mizoram, India"
AIZAWL,15030200301,2015-16,GOVT. SARON M/S,VENGHLUI,DAWRPUI,SARON,Mizoram,796001,,,,ChIJS3ECAbSUTTcRr0OPpV50VtM,C,City,aizawl,Govt. Primary School,"Dinthar Veng, Aizawl, Mizoram 796009, India"
AIZAWL,15030200302,2015-16,GOVT. SARON P/S,VENGHLUI,DAWRPUI,SARON,Mizoram,796001,,,,ChIJS3ECAbSUTTcRr0OPpV50VtM,C,City,aizawl,Govt. Primary School,"Dinthar Veng, Aizawl, Mizoram 796009, India"
AIZAWL,15030200303,2015-16,K.D. ELEMENTARY SCHOOL,VENGHLUI,DAWRPUI,SARON,Mizoram,796001,,,,,,,,,
MAMIT,15010103802,2015-16,HMUNTHATLANG UPS (SSA),MAMIT,KAWRTHAH,HMUNTHATLANG,Mizoram,796441,,,,,,,,,
MAMIT,15010104301,2015-16,GOVT. MAMIT P/S II ,MAMIT,NEW MAMIT,MAMIT CHHIM VENG,Mizoram,796441,,,,ChIJ2xzoZpr3TTcRCUGaWgLInnI,B,Locality,mamit,"Govt M/S II, Mamit","CHHIM VENG, Mamit, Mizoram 796441, India"
MAMIT,15010104302,2015-16,GOVT. MAMIT M/S II,MAMIT,NEW MAMIT,MAMIT CHHIM VENG,Mizoram,796441,,,,ChIJ2xzoZpr3TTcRCUGaWgLInnI,B,Locality,mamit,"Govt M/S II, Mamit","CHHIM VENG, Mamit, Mizoram 796441, India"
MAMIT,15010104303,2015-16,HMUNSAM PUBLIC P/S (SSA),MAMIT,NEW MAMIT,MAMIT CHHIM VENG,Mizoram,796441,,,,,,,,,
MAMIT,15010104304,2015-16,HMUNSAM PUBLIC UPS (SSA),MAMIT,NEW MAMIT,MAMIT CHHIM VENG,Mizoram,796441,,,,,,,,,
AIZAWL,15030200609,2015-16,GOVT. AIZAWL HIGH SCHOOL,VENGHLUI,VENGHLUI,REPUBLIC,Mizoram,796001,,,,ChIJA2yrPMKUTTcRF0Chtlxn7E4,A,VILLAGE_NAME,republic,Government Aizawl High School,"Republic Veng, Aizawl, Mizoram 796005, India"
AIZAWL,15030200610,2015-16,SPRINGFIELD ENGLISH SECONDARY SCHOOL,VENGHLUI,VENGHLUI,REPUBLIC,Mizoram,796001,,,,ChIJUzJyQ8GUTTcRb5QLE0pkF90,A,VILLAGE_NAME,republic,Springfield Higher Secondary School,"Aizawl, Republic Veng, Aizawl, Mizoram 796005, India"
AIZAWL,15030200612,2015-16,SPRINGFIELD HIGHER SECONDARY SCHOOL,VENGHLUI,VENGHLUI,REPUBLIC,Mizoram,796001,,,,ChIJUzJyQ8GUTTcRb5QLE0pkF90,A,VILLAGE_NAME,republic,Springfield Higher Secondary School,"Aizawl, Republic Veng, Aizawl, Mizoram 796005, India"
AIZAWL,15030200701,2015-16,HOLY HEART SCHOOL,VENGHLUI,VENGHLUI,UPPER REPUBLIC,Mizoram,796001,,,,ChIJq9Tu3sCUTTcR53Zm7lw33Xg,C,City,aizawl,Holy Heart School,"MG Rd, Republic Veng, Aizawl, Mizoram 796005, India"
MAMIT,15010300502,2015-16,GOVT. W. SERZAWL M/S,RAWPUICHHIP,LENGTE,W. SERZAWL,Mizoram,796410,,,,,,,,,
MAMIT,15010101708,2015-16,SOTAPA UPS (SSA),MAMIT,KAWRTETHAWVENG,W. BUNGHMUN,Mizoram,796441,,,,,,,,,
MAMIT,15010101710,2015-16,W. BUNGHMUN HIGH SCHOOL (ADHOC AIDED),MAMIT,KAWRTHAH,W. BUNGHMUN,Mizoram,796431,,,,ChIJM79GcWkMUjcRgLQ6vlCZs7k,B,Locality,mamit,W.Bunghmun High School,"Mamit, Mizoram, India"
MAMIT,15010101801,2015-16,GOVT. SERHMUN P/S,MAMIT,KAWRTETHAWVENG,W. SERHMUN,Mizoram,796441,,,,,,,,,
AIZAWL,15030200401,2015-16,GOVT. TUITHIANG ELEMENTARY P/S,VENGHLUI,BETHLEHEM,TUITHIANG,Mizoram,796008,,,,,,,,,
AIZAWL,15030200402,2015-16,GOVT. TUITHIANG ELEMENTARY M/S,VENGHLUI,BETHLEHEM,TUITHIANG,Mizoram,796001,,,,,,,,,
AIZAWL,15030200501,2015-16,GOVT. VENGHLUI P/S,VENGHLUI,BETHLEHEM,VENGHLUI,Mizoram,796001,,,,ChIJQ8MLdMeUTTcRaGLMhlHpnSU,A,VILLAGE_NAME,venghlui,"Planning & Programme Implementation Department, Government Of Mizoram","Treasury Square, Venghlui, Aizawl, Mizoram 796001, India"
AIZAWL,15030200502,2015-16,GOVT. BIBLE M/S,VENGHLUI,VENGHLUI,VENGHLUI,Mizoram,796001,,,,,,,,,
MAMIT,15010104305,2015-16,GOVT. MAMIT HIGHER SECONDARY SCHOOL,MAMIT,MAMIT,MAMIT CHHIM VENG,Mizoram,796441,,,,ChIJp-IR_Jr3TTcR_p0ZT957TzU,A,Street Address,mamit,Govt. Mamit High School,"CHHIM VENG, Mamit, Mizoram 796441, India"
MAMIT,15010104306,2015-16,GOVT. MAMIT HIGH SCHOOL,MAMIT,MAMIT,MAMIT CHHIM VENG,Mizoram,796441,,,,ChIJp-IR_Jr3TTcR_p0ZT957TzU,A,Street Address,mamit,Govt. Mamit High School,"CHHIM VENG, Mamit, Mizoram 796441, India"
MAMIT,15010104307,2015-16,NEW DIAMOND ENGLISH MEDIUM SCHOOL,MAMIT,NEW MAMIT,MAMIT CHHIM VENG,Mizoram,796441,,,,,,,,,
MAMIT,15010105501,2015-16,SIHTHIANG UPS (SSA),MAMIT,KAWRTHAH,SIHTHIANG,Mizoram,796445,,,,,,,,,
AIZAWL,15030200702,2015-16,UPPER REPUBLIC MODEL P/S (SSA),VENGHLUI,VENGHLUI,UPPER REPUBLIC,Mizoram,796001,,,,ChIJR7KPQcGUTTcRG5LdeMzj6FU,A,VILLAGE_NAME,upper republic,City Car Bazar & Rental,"Upper Republic, Aizawl, Mizoram 796001, India"
AIZAWL,15030200707,2015-16,UPPER REPUBLIC MODEL M/S (SSA),VENGHLUI,VENGHLUI,UPPER REPUBLIC,Mizoram,796001,,,,ChIJR7KPQcGUTTcRG5LdeMzj6FU,A,VILLAGE_NAME,upper republic,City Car Bazar & Rental,"Upper Republic, Aizawl, Mizoram 796001, India"
AIZAWL,15030200708,2015-16,NEW HOPE ACADEMY,VENGHLUI,VENGHLUI,UPPER REPUBLIC,Mizoram,796001,,,,,,,,,
AIZAWL,15030200709,2015-16,NEW HOPE ACADEMY (HSS),VENGHLUI,VENGHLUI,UPPER REPUBLIC,Mizoram,796001,,,,,,,,,
MAMIT,15010101803,2015-16,W. SERHMUN P/S-II (SSA),MAMIT,KAWRTETHAWVENG,W. SERHMUN,Mizoram,796441,,,,,,,,,
MAMIT,15010101804,2015-16,GOVT. TAITESENA MEMORIAL M/S,MAMIT,KAWRTETHAWVENG,W. SERHMUN,Mizoram,796441,,,,,,,,,
MAMIT,15010101805,2015-16,SERHMUN RMSA SECONDARY SCHOOL,MAMIT,KAWRTETHAWVENG,W. SERHMUN,Mizoram,796441,,,,,,,,,
MAMIT,15010101901,2015-16,GOVT. BAWRAI P/S,MAMIT,ZAWLNUAM,BAWRAI,Mizoram,796471,,,,,,,,,
MAMIT,15010101902,2015-16,GOVT. BAWRAI M/S,MAMIT,ZAWLNUAM,BAWRAI,Mizoram,796647,,,,,,,,,
AIZAWL,15030200504,2015-16,GOVT. MICE P/S,VENGHLUI,VENGHLUI,VENGHLUI,Mizoram,796001,,,,ChIJWcGL_saUTTcRvnC2JJQPxcM,A,Street Address,venghlui,Mizoram Institute of Comprehensive Education (MICE),"Venghlui, Aizawl, Mizoram 796005, India"
AIZAWL,15030200507,2015-16,GOVT. MICE HIGH SCHOOL,VENGHLUI,VENGHLUI,VENGHLUI,Mizoram,796001,,,,ChIJWcGL_saUTTcRvnC2JJQPxcM,A,Street Address,venghlui,Mizoram Institute of Comprehensive Education (MICE),"Venghlui, Aizawl, Mizoram 796005, India"
AIZAWL,15030200510,2015-16,GOVT. MICE HIGHER SECONDARY SCHOOL,VENGHLUI,BETHLEHEM,VENGHLUI,Mizoram,796001,,,,ChIJWcGL_saUTTcRvnC2JJQPxcM,A,VILLAGE_NAME,venghlui,Mizoram Institute of Comprehensive Education (MICE),"Venghlui, Aizawl, Mizoram 796005, India"
AIZAWL,15030200512,2015-16,GOVT. MICE M/S,VENGHLUI,VENGHLUI,VENGHLUI,Mizoram,796001,,,,ChIJWcGL_saUTTcRvnC2JJQPxcM,A,Street Address,venghlui,Mizoram Institute of Comprehensive Education (MICE),"Venghlui, Aizawl, Mizoram 796005, India"
MAMIT,15010105502,2015-16,SYNOD HOME MISSION SCHOOL SIHTHIANG (Pvt.),MAMIT,KAWRTHAH,SIHTHIANG,Mizoram,796443,,,,,,,,,
MAMIT,15010105503,2015-16,SIHTHIANG P/S (SSA),MAMIT,KAWRTHAH,SIHTHIANG,Mizoram,796445,,,,,,,,,
MAMIT,15010105601,2015-16,"RAJIV GANDHI MEMORIAL SCHOOL P/S, KOLALIAN (SSA)",MAMIT,SAIKHAWTHLIR,KOLALIAN,Mizoram,796471,,,,,,,,,
KOLASIB,15020101015,2015-16,RAIL STATION UPS BAIRABI (SSA),KOLASIB,BAIRABI,BAIRABI (LENHMUIKAWN),Mizoram,796081,,,,ChIJEXCLXLMGTjcRyfO7ak7VRsc,A,Street Address,bairabi,Rail-Station UPS School,"Bairabi, Mizoram 796081, India"
AIZAWL,15030200710,2015-16,ZABANGA HIGHER SECONDARY SCHOOL,VENGHLUI,VENGHLUI,UPPER REPUBLIC,Mizoram,796007,,,,ChIJtXvovkrrTTcRCbsr2WBftks,B,Pincode,796007,Govt. Mizo Higher Secondary School,"Chanmari, Aizawl, Mizoram 796007, India"
AIZAWL,15030200711,2015-16,ZABANGA HIGH SCHOOL,VENGHLUI,VENGHLUI,UPPER REPUBLIC,Mizoram,796007,,,,ChIJtXvovkrrTTcRCbsr2WBftks,B,Pincode,796007,Govt. Mizo Higher Secondary School,"Chanmari, Aizawl, Mizoram 796007, India"
AIZAWL,15030200801,2015-16,GOVT. COLLEGE VENG P/S,VENGHLUI,VENGHLUI,COLLEGE VENG,Mizoram,796001,,,,ChIJBVWpdsCUTTcRvCoieBLFef8,B,Pincode,796001,Government Aizawl College,"Aizawl, Mizoram 796001, India"
AIZAWL,15030200802,2015-16,GOVT. VENGHLUI M/S,VENGHLUI,VENGHLUI,COLLEGE VENG,Mizoram,796001,,,,ChIJWcGL_saUTTcRvnC2JJQPxcM,A,Street Address,venghlui,Mizoram Institute of Comprehensive Education (MICE),"Venghlui, Aizawl, Mizoram 796005, India"
AIZAWL,15030200807,2015-16,GOVT. CENTRAL HIGH SCHOOL,VENGHLUI,VENGHLUI,COLLEGE VENG,Mizoram,796001,,,,ChIJtXvovkrrTTcRCbsr2WBftks,C,City,aizawl,Govt. Mizo Higher Secondary School,"Chanmari, Aizawl, Mizoram 796007, India"
KOLASIB,15020101020,2015-16,LENHMUIKAWN UPS (SSA),KOLASIB,BAIRABI,BAIRABI (LENHMUIKAWN),Mizoram,796081,,,,,,,,,
KOLASIB,15020101021,2015-16,"GREEN HILLS KIDS CARE SCHOOL, BAIRABI",KOLASIB,BAIRABI,BAIRABI (LENHMUIKAWN),Mizoram,796081,,,,,,,,,
KOLASIB,15020101101,2015-16,GOVT. P/S PANGBALKAWN,KOLASIB,BAIRABI,PANGBALKAWN (S.CHHIMLUANG),Mizoram,796081,,,,,,,,,
KOLASIB,15020101102,2015-16,PANGBALKAWN M/S (ADHOC),KOLASIB,BAIRABI,PANGBALKAWN (S.CHHIMLUANG),Mizoram,796081,,,,,,,,,
KOLASIB,15020300302,2015-16,GOVT. M/S BUHCHANGPHAI,BILKHAWTHLIR, ,BUHCHANGPHAI,Mizoram,796091,,,,ChIJOW_bcEoQTjcRlcBVSR03bjw,A,VILLAGE_NAME,buhchangphai,Govt. Buhchangphai Primary School,"Vengchhak, Buhchangphai, Mizoram 796091, India"
KOLASIB,15020300309,2015-16,BUHCHANGPHAI HIGH SCHOOL (ADHOC),BILKHAWTHLIR,BILKHAWTHLIR,BUHCHANGPHAI,Mizoram,796091,,,,ChIJ0WTH-zUQTjcRhPlo0pLNneU,A,VILLAGE_NAME,buhchangphai,Adhoc Aided Buhchangphai High School,"Buhchangphai, Mizoram 796091, India"
KOLASIB,15020301407,2015-16,COVENANT ENGLISH SCHOOL SAIPUM,BILKHAWTHLIR,VAIRENGTE,SAIPUM,Mizoram,796091,,,,,,,,,
KOLASIB,15020301501,2015-16,GOVT. TM P/S SAIPHAI,BILKHAWTHLIR,VAIRENGTE,SAIPHAI,Mizoram,796091,,,,,,,,,
KOLASIB,15020101016,2015-16,GREEN HILLS KIDS CARE SCHOOL,KOLASIB,BAIRABI,BAIRABI (LENHMUIKAWN),Mizoram,796081,,,,,,,,,
KOLASIB,15020101017,2015-16,ST.VINCENT'S SCHOOL,KOLASIB,BAIRABI,BAIRABI (LENHMUIKAWN),Mizoram,796081,,,,ChIJU60WWC0BTjcROuO6Zip4FkA,A,Street Address,bairabi,St.Vincent School,"National Highway 154, Bairabi, Mizoram 796081, India"
KOLASIB,15020101019,2015-16,"GOVT. HIGH SCHOOL, BAIRABI",KOLASIB,BAIRABI,BAIRABI (LENHMUIKAWN),Mizoram,796081,,,,ChIJQb3dd84OTjcRQ7zB4qRqE_E,B,Locality,kolasib,Govt. High School,"Project Veng, Kolasib, Mizoram 796081, India"
KOLASIB,15020200605,2015-16,"LALTHANHAWLA RMSA SECONDARY SCHOOL, SERKHAN",KAWNPUI,KAWNPUI,SERKHAN,Mizoram,796070,,,,,,,,,
KOLASIB,15020200701,2015-16,GOVT. P/S - I LUNGDAI,KAWNPUI,LUNGDAI,LUNGDAI,Mizoram,796070,,,,,,,,,
AIZAWL,15030100903,2015-16,GOVT. RAMTHAR P/S-II,ELECTRIC,ELECTRIC,RAMTHAR,Mizoram,796007,,,,,,,,,
AIZAWL,15030100904,2015-16,ST. LAWRENCE SCHOOL,ELECTRIC,ELECTRIC,RAMTHAR,Mizoram,796008,,,,ChIJYaFBwDLrTTcRnq9RJech1yQ,A,VILLAGE_NAME,ramthar,St. Lawrence School,"Ramthar Veng, Aizawl, Mizoram 796007, India"
AIZAWL,15030100905,2015-16,"PRESBY. ENGLISH SCHOOL, RAMTHAR",ELECTRIC,ELECTRIC,RAMTHAR,Mizoram,796007,,,,ChIJ57YwErbsTTcRTtXLXUGSQzg,C,City,aizawl,Presbyterian English School,"Tuivamit, Aizawl, Mizoram 796009, India"
KOLASIB,15020200315,2015-16,"HOLY CHILD  ENGLISH ACADEMY, THINGDAWL",KAWNPUI,THINGDAWL (SETHAWN),THINGDAWL (SETHAWN),Mizoram,796082,,,,,,,,,
KOLASIB,15020200316,2015-16,GOVT. SETHAWN P/S,KAWNPUI,THINGDAWL (SETHAWN),THINGDAWL (SETHAWN),Mizoram,796075,,,,,,,,,
KOLASIB,15020101104,2015-16,S.CHHIMLUANG P/S,KOLASIB,BAIRABI,PANGBALKAWN (S.CHHIMLUANG),Mizoram,796081,,,,,,,,,
KOLASIB,15020101105,2015-16,S CHHIMLUANG UPS (SSA),KOLASIB,BAIRABI,PANGBALKAWN (S.CHHIMLUANG),Mizoram,796081,,,,,,,,,
KOLASIB,15020101108,2015-16,MELANIE ENGLISH SCHOOL,KOLASIB,BAIRABI,PANGBALKAWN (S.CHHIMLUANG),Mizoram,796081,,,,,,,,,
KOLASIB,15020101201,2015-16,GOVT. P/S - XII KOLASIB,KOLASIB,KOLASIB,RENGTEKAWN,Mizoram,796081,,,,ChIJoz_3CMkOTjcRCyasSXTKoTc,A,Street Address,kolasib,Government Kolasib College,"Venglai, Kolasib, Mizoram 796081, India"
KOLASIB,15020301502,2015-16,GOVT. P/S SAIPHAI,BILKHAWTHLIR,VAIRENGTE,SAIPHAI,Mizoram,79091,,,,ChIJmQ_CgV9rTjcRFrYqX2bWdp0,A,VILLAGE_NAME,saiphai,Govt. High School,"Saiphai, Mizoram 796101, India"
KOLASIB,15020301503,2015-16,GOVT. M/S SAIPHAI,BILKHAWTHLIR,VAIRENGTE,SAIPHAI,Mizoram,796091,,,,ChIJmQ_CgV9rTjcRFrYqX2bWdp0,A,VILLAGE_NAME,saiphai,Govt. High School,"Saiphai, Mizoram 796101, India"
KOLASIB,15020301506,2015-16,COVENANT ENGLISH SCHOOL P/S,BILKHAWTHLIR,VAIRENGTE,SAIPHAI,Mizoram,796091,,,,,,,,,
KOLASIB,15020301509,2015-16,GOVT. SAIPHAI HIGH SCHOOL,BILKHAWTHLIR,BILKHAWTHLIR,SAIPHAI,Mizoram,796091,,,,ChIJmQ_CgV9rTjcRFrYqX2bWdp0,A,VILLAGE_NAME,saiphai,Govt. High School,"Saiphai, Mizoram 796101, India"
KOLASIB,15020301510,2015-16,"PMS ENGLISH HIGH SCHOOL, SAIPHAI",BILKHAWTHLIR,BILKHAWTHLIR,SAIPHAI,Mizoram,796101,,,,,,,,,
KOLASIB,15020200702,2015-16,GOVT. P/S - II LUNGDAI,KAWNPUI,LUNGDAI,LUNGDAI,Mizoram,796070,,,,,,,,,
KOLASIB,15020200703,2015-16,GOVT. P/S - III LUNGDAI,KAWNPUI,LUNGDAI,LUNGDAI,Mizoram,796070,,,,,,,,,
KOLASIB,15020200704,2015-16,GOVT. M/S - I LUNGDAI,KAWNPUI,LUNGDAI,LUNGDAI,Mizoram,796014,,,,ChIJJRyaulfoTTcRk6lDm0edaWs,B,Pincode,796014,Govt PM H/S Lungdai,"Sentlang, Mizoram 796014, India"
KOLASIB,15020200705,2015-16,GOVT. M/S - II LUNGDAI,KAWNPUI,LUNGDAI,LUNGDAI,Mizoram,796014,,,,ChIJ98hcMlboTTcRdTLN6k1ffBQ,B,Pincode,796014,Govt Middle School II LUNGDAI,"Sentlang, Mizoram 796014, India"
KOLASIB,15020200318,2015-16,GOVT. THINGDAWL HIGH SCHOOL,KAWNPUI,THINGDAWL (SETHAWN),THINGDAWL (SETHAWN),Mizoram,796082,,,,,,,,,
KOLASIB,15020200319,2015-16,JNV (HIGH SCHOOL SECTION),KAWNPUI,KAWNPUI,THINGDAWL (SETHAWN),Mizoram,796075,,,,,,,,,
KOLASIB,15020200320,2015-16,JNV (HIGHER SECONDARY SECTION),KAWNPUI,THINGDAWL (SETHAWN),THINGDAWL (SETHAWN),Mizoram,796075,,,,ChIJfdK_FoYJTjcR5PrerYKE5Hw,B,Pincode,796075,JNV,"NH 54, North Thingdawl, Mizoram 796075, India"
KOLASIB,15020200401,2015-16,GOVT. P/S BUALPUI,KAWNPUI,KAWNPUI,BUALPUI `N,Mizoram,796070,,,,,,,,,
KOLASIB,15020101202,2015-16,GOVT. TS LUAIA M/S RENGTEKAWN,KOLASIB,KOLASIB,RENGTEKAWN,Mizoram,796081,,,,,,,,,
KOLASIB,15020101203,2015-16,GOSEN P/S (SSA),KOLASIB,KOLASIB,RENGTEKAWN,Mizoram,796081,,,,,,,,,
KOLASIB,15020101205,2015-16,"RENGTEKAWN HIGH SCHOOL, KOLASIB (LUMPSUM)",KOLASIB,KOLASIB,RENGTEKAWN,Mizoram,796081,,,,ChIJA_uEXMYOTjcRhlfhNk1gI0A,A,Street Address,kolasib,St. John's Higher Secondary School,"Venglai, Kolasib, Mizoram 796081, India"
KOLASIB,15020101209,2015-16,K/M. THANGA ENG. MED SCHOOL,KOLASIB,KOLASIB,RENGTEKAWN,Mizoram,796081,,,,,,,,,
KOLASIB,15020101301,2015-16,GOVT. P/S - IX KOLASIB,KOLASIB,KOLASIB,COLLEGE VENG,Mizoram,796081,,,,ChIJoz_3CMkOTjcRCyasSXTKoTc,A,Street Address,kolasib,Government Kolasib College,"Venglai, Kolasib, Mizoram 796081, India"
KOLASIB,15020301511,2015-16,PMS ENGLISH M/S SAIPHAI,BILKHAWTHLIR,VAIRENGTE,SAIPHAI,Mizoram,796091,,,,,,,,,
